{"answer_text":"2019年，国内零售消费增长放缓、分化明显，国产品牌遭遇了来自消费升级、渠道升级、智能穿戴等诸多方面的压力。\n报告期内，公司依托专业制表所积累的精密科技优势和较成熟的产业基础，继续推动精密科技业务发展和智能表业务探索。\n1、2020年初突然爆发的新型冠状病毒肺炎疫情，对行业带来严重负面影响。\n董事会下设的战略委员会的履职情况汇总报告：\n信用风险，是指交易对手未能履行合同义务而导致本集团产生财务损失的风险。","citations":[{"citation_id":"cite_evidence_6261fef599344d49d8ad","citation_kind":"evidence","document_id":"A000026_飞亚达_2019年年度报告","entity_key":"000026","provenance":{"content_sha256":"2c1f6bb5feb9782e3917485610cf13e5de0e98d543ab09c43b7d97b03278c783","document_chunk_ordinal":14,"evidence_chunk_id":"chunk-124ac6c44e75a8f11afa7a53452b6712","line_range":[153,155],"score":"0.67231375","section_path":["飞亚达精密科技股份有限公司","一、概述"],"semantic_tags":["business","rd","shareholder"],"source_markdown":"A000026_2019_A000026_飞亚达_2019年年度报告.md"},"source_citation_ids":[],"subplan_id":"sp_0c09e6f2bfcb1f39"},{"citation_id":"cite_evidence_148774e42aa96960c5dd","citation_kind":"evidence","document_id":"A000026_飞亚达_2019年年度报告","entity_key":"000026","provenance":{"content_sha256":"428a07fddc1d1b708e3081a343fcfb387fbe74be1c9b268113a608de65f244ee","document_chunk_ordinal":19,"evidence_chunk_id":"chunk-23f59e14bbc959a7da0a3dfb9ff8cd7d","line_range":[175,177],"score":"0.64527696","section_path":["飞亚达精密科技股份有限公司","五、培育新增长点，新业务继续保持了较快的增长"],"semantic_tags":["business","rd","shareholder"],"source_markdown":"A000026_2019_A000026_飞亚达_2019年年度报告.md"},"source_citation_ids":[],"subplan_id":"sp_0c09e6f2bfcb1f39"},{"citation_id":"cite_evidence_b8df71f47a7a2a5c9ef3","citation_kind":"evidence","document_id":"A000026_飞亚达_2019年年度报告","entity_key":"000026","provenance":{"content_sha256":"d639c83413d8e5e8ea361a0c1ec8348a123ccfe00875881925482208526adb76","document_chunk_ordinal":50,"evidence_chunk_id":"chunk-96b912fc5b6c4cfe15c8c777997b677f","line_range":[430,434],"score":"0.70810783","section_path":["飞亚达精密科技股份有限公司","五、可能面对的风险"],"semantic_tags":["business","risk","rd","financial","shareholder"],"source_markdown":"A000026_2019_A000026_飞亚达_2019年年度报告.md"},"source_citation_ids":[],"subplan_id":"sp_0c09e6f2bfcb1f39"},{"citation_id":"cite_evidence_5971bba4b25e508d2021","citation_kind":"evidence","document_id":"A000026_飞亚达_2019年年度报告","entity_key":"000026","provenance":{"content_sha256":"26d348cf8374b3040990573a7adfd78dfda98b4115e3aadc635033376d658756","document_chunk_ordinal":111,"evidence_chunk_id":"chunk-e9c83fe2bbff4ec13c995cafe4010eea","line_range":[1032,1034],"score":"0.63491249","section_path":["第八节可转换公司债券相关情况","六、董事会下设专门委员会在报告期内履行职责情况"],"semantic_tags":["governance"],"source_markdown":"A000026_2019_A000026_飞亚达_2019年年度报告.md"},"source_citation_ids":[],"subplan_id":"sp_0c09e6f2bfcb1f39"},{"citation_id":"cite_evidence_2b2df1eae6a734466065","citation_kind":"evidence","document_id":"A000026_飞亚达_2019年年度报告","entity_key":"000026","provenance":{"content_sha256":"80587174de8ec1028eace270054ecd556a27edc74d74fb551adeab1c6fe53216","document_chunk_ordinal":346,"evidence_chunk_id":"chunk-e82d3c6331f3c39d77f4b2e3cbda48ba","line_range":[3510,3524],"score":"0.63817650","section_path":["第八节可转换公司债券相关情况","（1）信用风险"],"semantic_tags":["business","risk","financial"],"source_markdown":"A000026_2019_A000026_飞亚达_2019年年度报告.md"},"source_citation_ids":[],"subplan_id":"sp_0c09e6f2bfcb1f39"}],"composition_pattern_id":"single_node","document_scope":{"corpus_scope":null,"entity_resolutions":[{"document_set":[{"artifact_fingerprint":"92f9ecbffadfe7086fba77c0e05e084dbd52ec6737b411bfc33e92930c865571","document_id":"A000026_飞亚达_2019年年度报告","report_year":2019,"stock_code":"000026"}],"entity_key":"000026","findings":[],"identity":{"company_full":"飞亚达精密科技股份有限公司","stock_code":"000026","stock_name":"飞亚达"},"mention":"飞亚达","mention_ordinal":0,"status":"unique"}],"explicit_document_ids":[],"findings":[],"metric_years":[2019],"phase8_capabilities":{"evidence":"direct","fact":"direct","formula":"direct","sql":"direct"},"report_year_constraints":[2019],"resolution_skipped_reason":null,"resolver_version":"phase8-scope-resolver-v1.0.0","schema_version":"finglmqa.phase8.scope_plan.v1","scope_kind":"single_document","scope_plan_id":"scope_1d54f577305e6f6b0d3c"},"errors":[],"missing_fact_requests":[],"request_id":"phase8-real-evidence-smoke","result":{"comparison":null,"composition_policy_id":"single_passthrough","section_axis":"none","sections":[{"entity_key":null,"items":[{"backend":"evidence","claims":[{"citation_ids":["cite_evidence_6261fef599344d49d8ad"],"claim_id":"claim_3d1e37b0f032ec4c3fbe","company":"飞亚达","document_id":"A000026_飞亚达_2019年年度报告","entity_key":"000026","numeric_authorization_ids":[],"text":"2019年，国内零售消费增长放缓、分化明显，国产品牌遭遇了来自消费升级、渠道升级、智能穿戴等诸多方面的压力。"},{"citation_ids":["cite_evidence_148774e42aa96960c5dd"],"claim_id":"claim_1c6c87b46d810b84b667","company":"飞亚达","document_id":"A000026_飞亚达_2019年年度报告","entity_key":"000026","numeric_authorization_ids":[],"text":"报告期内，公司依托专业制表所积累的精密科技优势和较成熟的产业基础，继续推动精密科技业务发展和智能表业务探索。"},{"citation_ids":["cite_evidence_b8df71f47a7a2a5c9ef3"],"claim_id":"claim_7655fa00ecdd1b528564","company":"飞亚达","document_id":"A000026_飞亚达_2019年年度报告","entity_key":"000026","numeric_authorization_ids":[],"text":"1、2020年初突然爆发的新型冠状病毒肺炎疫情，对行业带来严重负面影响。"},{"citation_ids":["cite_evidence_5971bba4b25e508d2021"],"claim_id":"claim_d30456908a46dae38031","company":"飞亚达","document_id":"A000026_飞亚达_2019年年度报告","entity_key":"000026","numeric_authorization_ids":[],"text":"董事会下设的战略委员会的履职情况汇总报告："},{"citation_ids":["cite_evidence_2b2df1eae6a734466065"],"claim_id":"claim_2ae61328af5210b33c9f","company":"飞亚达","document_id":"A000026_飞亚达_2019年年度报告","entity_key":"000026","numeric_authorization_ids":[],"text":"信用风险，是指交易对手未能履行合同义务而导致本集团产生财务损失的风险。"}],"concern_key":"concern_81c3e6a66f278849","operation":"document_retrieval","result":{"chunks":[{"chunk_id":"chunk-96b912fc5b6c4cfe15c8c777997b677f","company":"飞亚达","content_sha256":"d639c83413d8e5e8ea361a0c1ec8348a123ccfe00875881925482208526adb76","document_chunk_ordinal":50,"document_id":"A000026_飞亚达_2019年年度报告","line_range":[430,434],"report_year":2019,"score":"0.70810783","section_path":["飞亚达精密科技股份有限公司","五、可能面对的风险"],"semantic_tags":["business","risk","rd","financial","shareholder"],"source_markdown":"A000026_2019_A000026_飞亚达_2019年年度报告.md","stock_code":"000026"},{"chunk_id":"chunk-124ac6c44e75a8f11afa7a53452b6712","company":"飞亚达","content_sha256":"2c1f6bb5feb9782e3917485610cf13e5de0e98d543ab09c43b7d97b03278c783","document_chunk_ordinal":14,"document_id":"A000026_飞亚达_2019年年度报告","line_range":[153,155],"report_year":2019,"score":"0.67231375","section_path":["飞亚达精密科技股份有限公司","一、概述"],"semantic_tags":["business","rd","shareholder"],"source_markdown":"A000026_2019_A000026_飞亚达_2019年年度报告.md","stock_code":"000026"},{"chunk_id":"chunk-23f59e14bbc959a7da0a3dfb9ff8cd7d","company":"飞亚达","content_sha256":"428a07fddc1d1b708e3081a343fcfb387fbe74be1c9b268113a608de65f244ee","document_chunk_ordinal":19,"document_id":"A000026_飞亚达_2019年年度报告","line_range":[175,177],"report_year":2019,"score":"0.64527696","section_path":["飞亚达精密科技股份有限公司","五、培育新增长点，新业务继续保持了较快的增长"],"semantic_tags":["business","rd","shareholder"],"source_markdown":"A000026_2019_A000026_飞亚达_2019年年度报告.md","stock_code":"000026"},{"chunk_id":"chunk-e82d3c6331f3c39d77f4b2e3cbda48ba","company":"飞亚达","content_sha256":"80587174de8ec1028eace270054ecd556a27edc74d74fb551adeab1c6fe53216","document_chunk_ordinal":346,"document_id":"A000026_飞亚达_2019年年度报告","line_range":[3510,3524],"report_year":2019,"score":"0.63817650","section_path":["第八节可转换公司债券相关情况","（1）信用风险"],"semantic_tags":["business","risk","financial"],"source_markdown":"A000026_2019_A000026_飞亚达_2019年年度报告.md","stock_code":"000026"},{"chunk_id":"chunk-e9c83fe2bbff4ec13c995cafe4010eea","company":"飞亚达","content_sha256":"26d348cf8374b3040990573a7adfd78dfda98b4115e3aadc635033376d658756","document_chunk_ordinal":111,"document_id":"A000026_飞亚达_2019年年度报告","line_range":[1032,1034],"report_year":2019,"score":"0.63491249","section_path":["第八节可转换公司债券相关情况","六、董事会下设专门委员会在报告期内履行职责情况"],"semantic_tags":["governance"],"source_markdown":"A000026_2019_A000026_飞亚达_2019年年度报告.md","stock_code":"000026"}],"claim_count":5,"company":"飞亚达","document_id":"A000026_飞亚达_2019年年度报告","provider_fingerprint":"dec6b55fa69c489d0d2e86abf605ae1916016780cf9d3dc25e14700cbb799648","report_year":2019,"retrieval_method":"a2rag_dpr_bge_m3","stock_code":"000026"},"status":"ok","subplan_id":"sp_0c09e6f2bfcb1f39"}],"period_key":null,"section_key":"answer"}],"unavailable_subplans":[]},"schema_version":"finglmqa.phase8.qa_answer.v1","status":"ok","subplans":[{"backend":"evidence","citations":[{"citation_id":"cite_evidence_6261fef599344d49d8ad","citation_kind":"evidence","document_id":"A000026_飞亚达_2019年年度报告","entity_key":"000026","provenance":{"content_sha256":"2c1f6bb5feb9782e3917485610cf13e5de0e98d543ab09c43b7d97b03278c783","document_chunk_ordinal":14,"evidence_chunk_id":"chunk-124ac6c44e75a8f11afa7a53452b6712","line_range":[153,155],"score":"0.67231375","section_path":["飞亚达精密科技股份有限公司","一、概述"],"semantic_tags":["business","rd","shareholder"],"source_markdown":"A000026_2019_A000026_飞亚达_2019年年度报告.md"},"source_citation_ids":[],"subplan_id":"sp_0c09e6f2bfcb1f39"},{"citation_id":"cite_evidence_148774e42aa96960c5dd","citation_kind":"evidence","document_id":"A000026_飞亚达_2019年年度报告","entity_key":"000026","provenance":{"content_sha256":"428a07fddc1d1b708e3081a343fcfb387fbe74be1c9b268113a608de65f244ee","document_chunk_ordinal":19,"evidence_chunk_id":"chunk-23f59e14bbc959a7da0a3dfb9ff8cd7d","line_range":[175,177],"score":"0.64527696","section_path":["飞亚达精密科技股份有限公司","五、培育新增长点，新业务继续保持了较快的增长"],"semantic_tags":["business","rd","shareholder"],"source_markdown":"A000026_2019_A000026_飞亚达_2019年年度报告.md"},"source_citation_ids":[],"subplan_id":"sp_0c09e6f2bfcb1f39"},{"citation_id":"cite_evidence_b8df71f47a7a2a5c9ef3","citation_kind":"evidence","document_id":"A000026_飞亚达_2019年年度报告","entity_key":"000026","provenance":{"content_sha256":"d639c83413d8e5e8ea361a0c1ec8348a123ccfe00875881925482208526adb76","document_chunk_ordinal":50,"evidence_chunk_id":"chunk-96b912fc5b6c4cfe15c8c777997b677f","line_range":[430,434],"score":"0.70810783","section_path":["飞